,learner_id,grades,nationality,writing_id,levels,unit,topic_id,topic_text,passage,query_sentence
353,128452,70.0,it,854141,5,4,36,Giving instructions to a house-sitter,"
      The Ada is my favourite restaurant. The local is very clean and friendly. The service is flawless. It's possible to eat ,outdoor or indoor. Are served many different appetizers and entrees, both land and sea. The &quot;Triumph of the sea&quot; is delicious with salmon in pink sauce, oyster with lemon,  shrimp and seafood. The soup of the seafood ,slightly spicy, is excellent. In the menu are present many main food, all delicious. Pasta with fish, pasta with meat, pasta with vegetables, the roast meat and fish. Also are served many side dishes of grilled vegetables, roasted or batter-fried. The fruits are always of season. The desserts are authentic local specialties: &quot;Seadas&quot; with honey, &quot;Pardulas&quot;, a delicious dessert with cheese and cakes with fresh fruit and cream. The prices are reasonable but is necessary make a reservation before . Is present a big, free parking into the garden.
    ","Is present a big , free parking into the garden ."
354,59569,90.0,it,854619,4,2,26,Describing routines,"
      February 20, 2014 Dear Mr Torrini, I am writing to recommend Mario Rossi. I had the pleasure to work with him for three Years at Garg_Sa Mr. Rossi is so well organized. Last project, concerning a communication AD for our most important customer, only took him two days. Is such a hard worker. He also works very well with the team. Please feel free to contact me about Mr. Rossi at +39.02.######## Sincerely, Luca Gaion
    ",Is such a hard worker .
355,132407,90.0,it,854732,4,5,29,Writing a description of your family,"
      Dear Caterina. Thanks a lot for inviting at your graduated party. The party was great and your friend are so lovely. I hope that will see very soon. The time with your it's wonderful.  Kiss a lot Stefano
    ",Thanks a lot for inviting at your graduated party .
356,132407,90.0,it,854733,4,6,30,Writing an autobiography,"
      Dear Simone, How are you? I'm having great time in Roma. Is a very interesting city with great monuments. I've been in the &quot;Colosseum&quot; an in the &quot;Phanteon&quot;. Well they are very very big and spectacular. I hope you visit Rome soon like me. Kiss Stefano
    ",Is a very interesting city with great monuments .
357,132407,90.0,it,854737,5,4,36,Giving instructions to a house-sitter,"
      The restaurant &quot;lighthouse&quot; is a place where the doing is the master of all. You can eat lots of appetizers such as mussels au gratin soup, mussels and clams, shrimp cocktail and many others. The pasta dishes are exceptional. Spaghetti with bottarga exquisite. The latter just as tasty as the totnno roasted sea bass or wine. is a little pricey, but well worth it for the freshness of the fish. At night, it is wonderful to sit on the terrace overlooking the sea.
    ","is a little pricey , but well worth it for the freshness of the fish ."
358,132407,80.0,it,854744,6,5,45,Writing on the family blog,"
      In Italy the employment is a very important problem for all the comunity. There are a lot of young man that are looking for their first job. This is the reason that it's most important to maintain employment levels. Is also important to find new manufacturing methods less expensive and more efficient, so they can sell their products at new customers that can't buy if the price is high for them. The layoff are a big problem for the future of the comunity because a person that can't buy is a family that can't buy and the economy get off.
    ","Is also important to find new manufacturing methods less expensive and more efficient , so they can sell their products at new customers that ca n't buy if the price is high for them ."
359,132407,95.0,it,854745,6,6,46,Writing an email of advice,"
      &quot;Blind Man's Bluff&quot; is a kinf of party game. you have to blindfold a person and this must try to catch the others. the game should be done in a room quite small. when a person is caught it then it is his turn to be blindfolded. is not allowed to raise the bandage during the game. is a very fun game for kids
    ",is not allowed to raise the bandage during the game .
360,140423,90.0,it,860284,12,1,89,Turning down an invitation,"
      Is difficult to judge what ever it is polite or not because it depends heavily on customs and traditions specific to each culture. A good way to tell if a behavior is just being polite in putting in place of the person who is in front of you and ask yourself if what you're doing can bother you. In Western culture, there are certain rules of conduct generally accepted by all. How to behave at the table, for example, has been abundantly discussed in the literature since the seventeenth century. Nowadays some rules of table manners are accepted and respected by all. For example, before you sit down at the table should wash your hands, you should not start eating before the host, you should not talk with your mouth full of food, you should clean your mouth before drinking to avoid leaving traces on the glass, you should not pour wine with the arm upside down, don't make phone calls or send sms while you are at the table and so on.
    ",Is difficult to judge what ever it is polite or not because it depends heavily on customs and traditions specific to each culture .
361,168982,80.0,it,860499,9,4,68,Signing a waiver to go skydiving,"
      In my country, we have strict laws about driving and using mobile phones. While driving you cannot use your cellphone, you can use it only if you are stopped roadside. I agree with these laws: using cellphones is a very distracting behavior, it could be very dangerous for ourselves and for people around us. If police catch you using your phone while driving, you get a fine and you also lose license-points. If you cause a car accident because you can also go to jail. Although these rules are very strict, many people find it hard to respect them. Is not uncommon see people on the phone while driving.
    ",Is not uncommon see people on the phone while driving .
362,168982,90.0,it,860516,12,3,91,Buying a painting for a friend,"
      I am not a &quot;natural born leader&quot;. I was pretty shy and I always preferred working alone than working in team. But during these last years I learned a lot of things about leadership and self-management. In these years I worked as a teacher in high school. When you are a teacher, you must be a leader. Otherwise students don't respect your work and your educative activities. Is not easy win the confidence of young students: they are in a diffucult age, they are not so interested in education, they prefer videogames and smartphone to school. At the beginning it was very hard. But colleagues and the principal helped me a lot during the first months of work. They suggested me how convey authoritativeness to young people and how excite students to study. Now I am very happy about my work and my professionalism. And I am one of the most loved and respected teacher in my school.
    ","Is not easy win the confidence of young students : they are in a diffucult age , they are not so interested in education , they prefer videogames and smartphone to school ."
363,168016,70.0,it,861171,5,1,33,Planning to attend a music festival,"
      I really loce bibioone!!!! is a big beach !!!! :D the sea is clean and not much profound!!!! there are three camping on the beach LIDO,CAPALONGA, but the more beautiful is the TRIDENTEEEEE!!!!!!!!!!I REALLY LOVE BIBI <3 <3 !!!!! ! ! :D =D
    ",is a big beach !
364,168016,90.0,it,861173,5,3,35,Labeling photos from a safari,"
      I playng and whath movie on the tv whit my best friends!! her name is Giulia and she hes got a big blue eyse and her hair is long straight and brown!!! she is very beautiful and nice'''''!!!!! has a good sense of humor, always joking together!!!!!I'm glad to have met you and that is my best friend!!!
    ","has a good sense of humor , always joking together !"
365,32559,95.0,it,866438,8,2,58,Reviewing a song for a website,"
      The place where i work is not very nice. There are 40 employees more or less. We don't have to wear formal dresses. Some employees work around 40 hours a week. Others work 18 or 25 hours a week. I don't like to go outside with other employees. My boss is very stressed out. I take around 3 weeks' vacation each year. Isn't hard for me to have a healthy work-life balance because i don't work too much. My private life is more important that my job. I live in Italy an here it's very hard to find work now. I hope situation can change soon!
    ",Is n't hard for me to have a healthy work-life balance because i do n't work too much .
366,65969,95.0,it,871675,10,1,73,Helping a friend find a job,"
      Hi Anna, I found a job that is by far the most suitable job for you. It is at the Flossington Zoo and they are looking for a zookeeper. I am sure you will like this job because you will be with animals all day long and you will have a lot of responsibilities such as preparing food for the animals and feeding them on a daily basis. Don't you think this job is absolutely amazing? The salary is pretty decent: $50,000 a year and you will have a 1 month holiday every day, they will cover your full accident insurance and the most amazing part is that you will make regular trips to Florida to observe wild crocodiles. Sounds exhilarating to me! I want to encourage you to apply for this job, i really think you would like it! Talk to you soon, Angela
    ",Sounds exhilarating to me !
367,78437,95.0,it,873423,10,6,78,Describing a terrifying experience,"
      I'm the Financial and Administration Manager of a medium Company. My work is hectic and demanding, so I experience an extreme amount of stress. Sometimes I feel like I have no social life because I work so much. Im a single woman and I live in a small flat. Although I dont live from paycheck to paycheck I have my expenses, such as the mortgage, insurance, school etc. Ive got everything I need and maybe more. Im active and have no money worries, but sometimes when I think about myself and my life in general I realized theres something missing. Im not sure where I want to be in life, I dont want to give up, but its getting harder. I would like to have my own family but I know very well that unfortunately this is not the right time, especially in this crisis time. However, I feel like I live a pretty good life overall. I'm happy, and I shouldn't complain.
    ",Im a single woman and I live in a small flat .
368,58688,95.0,it,882874,2,2,10,Writing a birthday invitation,"
      I'm sorry about the weather. Does not be sorry for the bad weather. Anyway, you should go visit museums, go to the movies and go shopping. On vacation and always great!
    ",Does not be sorry for the bad weather .
369,68589,90.0,it,885561,5,4,36,Giving instructions to a house-sitter,"
      The Boi Gordo Churrascaria is my favorite restaurant. They serve authentic Brasilian food. The price is very low, only 17. The appetizers is free and you can get it on the buffet's table. Their speciality is meat, they serve it on a sword and cut it directly on your table. Is fantastic. Their dessert speciality is Pineapple with cinnamon but there is a great selection of classic dessert: Tiramisu, chocolate cake, fresh strawberries with lemon... Outdoor seating is available in the summer, and parking is always free.
    ",Is fantastic .
370,68589,95.0,it,885569,6,6,46,Writing an email of advice,"
      My favorite game is chess. It's a kind of table game. In chess, there is two colors of checkers, whites and blacks and six types. Every type have to move in a specific way: in diagonal, in vertical, ecc. The player have to move the checkers on his turn. Is not allowed more than one move per turn. The purpose of the game is &quot;to eat&quot; checkers of the opponent and wins the player who manages to make checkmate.
    ",Is not allowed more than one move per turn .
371,104341,80.0,it,891822,1,3,3,Writing an online profile,"
      I live in Rome, Italy. Is the old, beautiful city. Is an exciting city. The downtown streets are crowded, the people  are visit the museums and works on the streets. It's great!
    ","Is the old , beautiful city ."
372,104341,80.0,it,891822,1,3,3,Writing an online profile,"
      I live in Rome, Italy. Is the old, beautiful city. Is an exciting city. The downtown streets are crowded, the people  are visit the museums and works on the streets. It's great!
    ",Is an exciting city .
373,16917,80.0,it,896075,3,2,18,Describing a friend's weekend routine,"
      MY city is on the sea, in the south of Italy and is about 400 kilometers from Rome. There is' a very important port for fishing. Is located on the east coast on the Adriatic sea.
    ",Is located on the east coast on the Adriatic sea .
374,44416,90.0,it,898271,7,5,53,Taking part in a TV viewing survey,"
      The Italians start their education at age 5 or 6, in elementary school. Then they graduate to middle school, and finally high school. Grades 1 through 5 are usually elementary school, grades 6 through 8 middle school, and grades 9 through 13 high school. After high school, students usually go to a university where they earn a three year degree. Then they can decide to earn a specialist degree, to have a master or to look for a job. Also in Italy there are private or public schools and universities. Generally there is the opinion that private schools are easier than publics, but it's not true for universities.
    ","Grades 1 through 5 are usually elementary school , grades 6 through 8 middle school , and grades 9 through 13 high school ."
375,116283,95.0,it,900865,1,3,3,Writing an online profile,"
      Marsala is small city and boring. Is not an expensive city and the are beautiful beaches. There are restaurants and old buildings.
    ",Is not an expensive city and the are beautiful beaches .
376,80826,90.0,it,901201,3,3,19,Renovating your home,"
      You can go to the Mediterranean's Hotel. Is on the sea, and it has clean and comfortable rooms. The hotel is clean and very cheap, and it has a big and funny pool and a nice fitness center. In there rooms there is also a fast and wireless internet connection. The price for a night in a room is about 100$.
    ","Is on the sea , and it has clean and comfortable rooms ."
377,29322,70.0,it,913045,7,3,51,Writing a job advertisement,"
      Good morning, im writting in response of your job advertisement for a position of a comuter programmer. I'am a lot expeiss in this position.  I'am able to developper programm application e to do system test. I an hardworker. I am able to have an interview with you whenever you like. You can reach me at this numer ########. I.have atthaced my revume. bests regard. t.
    ",I'am a lot expeiss in this position .
378,51988,80.0,it,914111,10,6,78,Describing a terrifying experience,"
      My life is overall good. I have the job that I like, a loving wife, and two wonderful children. My son is 26 and he already found his own way. My daughter is 23 and she is still studying. Certainly she will finish her studies next summer. My parents are very old but still healthy. I have a nice house in the suburbs. It is in a quiet place away from the stresses of the city. My wife and I have a good job without money worries. Nevertheless my job is very hectic and demanding. I usually work more than fifty hours a week and sometimes I have to finish part of my work at home. Sometimes it makes my wife nervous about it because I never have enough time for the housework. This situation often stress me. Consequently I have little free time and I can't do all I'd like to do: go to the cinema, go hiking, play and joke more with my wife. Years are going on. Maybe I should schedule my time better.
    ",Sometimes it makes my wife nervous about it because I never have enough time for the housework .
379,164056,90.0,it,917379,4,1,25,Writing about what you do,"
      The next week, in my city there is a concert of famous vocalist. Is a concert of rock music. The concert starts at 10 p.m.. It's at the city stadium. Admission is $ 20,00 for adult,  and free admission for children
    ",Is a concert of rock music .
380,8295,95.0,it,918029,4,5,29,Writing a description of your family,"
      Dear Marcia, I had a really good time at the cinema. Thanks a lot for inviting me. Next time we can see a film in my house after dinner. I hope to see you soon. Thanks Fernando
    ",Thanks a lot for inviting me .
381,109046,95.0,it,919942,7,4,52,Writing about a memorable experience,"
      I feel strongly that there are to many violence and transgressive advertising on TV in Italy. At any time, you can see horror film or action film with fighting or war. I think that these programme TV there should be only in the evening and from 11 pm onwards. In my opinion we need to stop watching these violent programs and demand more educational ones. Moreover I feel strongly that the rating system doesn't always help, because there is no difference between a rating &quot;yellow light and red light&quot;. Sometimes the programme is classified with &quot;yellow light&quot; instead there are too much violence or sex and the programme could be classified &quot;red light&quot; (only for adults). We need to ask for more restrictions on them.
    ",Sometimes the programme is classified with & quot ; yellow light & quot ; instead there are too much violence or sex and the programme could be classified & quot ; red light & quot ; ( only for adults ) .
382,129982,90.0,it,922236,5,5,37,Filling out an insurance claim form,"
      I just saw Read Window, It's a very good film, directed by Alfred Hichcock. It has a dark story. LB was played by James Stewart. L.B. is a photographer,but his leg is broken. He has to stay home, so he call an ambulance. I saw the remake last year, but isn't the same. I prefer the classic film It's better.
    ","is a photographer , but his leg is broken ."
383,173272,90.0,it,927451,10,3,75,Requesting a bank loan,"
      Well, fortunately I have had the possibility to work in three great company until now. Each of them in distinct sector; Neurofisiology, Informatics and Progect management. Working on the three jobs contemporary and working Saturday and Sunday too, my income is very high. My boyfriend is a university professor and earn well. So we bought two houses and many cars. We dont have children, only pets. In this time in Italy the economy is gone down dramatically. So the companies have reduced the salary and fired many employee. I hope that the labor market will turn around next year. Seems that the things are looking up!
    ",Seems that the things are looking up !
384,174307,90.0,it,939998,4,1,25,Writing about what you do,"
      This summer, there is going to be a fabulous big cultural party in my hometown. It's on July, 4th, admission is 20 $ for man, 10 $ for woman and children. It's very expensive but, when you are inside you can eat and drink everythings. Sounds good!! The party will start at 10 a.m. and will finsh at midnight. Last year there weren't about 15000 people at party. It was really crowded.
    ",Sounds good !
385,129666,95.0,it,943970,10,6,78,Describing a terrifying experience,"
      I have a really good life. Im a CFO in a small consultant company in Milan, Italy. I've been married for 10 years with a wonderful woman, who understands me and supports me. We have three kids the younger is just 2 years old. We live near my parents, so I get spend time with them. I have a certain amount of stress form my work, actually Im thinking to find a new job. I occasionally get a little nervous our house is to small for a five person family. Fortunately we dont have live from paycheck to paycheck. We have 3 kids, so we never be alone, but the work and all the activity of the gays takes all our free time and I feel the missing of my friends. I need to get in contact with someone older than 10 years whereby I can talk about my problems at work or confront on how to raise children. Ive decided to contact the my old classmates. Life isnt perfect, but Im learning to enjoy the good things while I try to accept the difficult things.
    ","Im a CFO in a small consultant company in Milan , Italy ."
386,40720,80.0,it,945397,1,4,4,Describing your family in an email,"
      Alessandro i live in Bari. Has 40 years hold. He's short and has blonde hair, blu eyes. He very friendly. Alessandro is very serios and hardworking
    ",Has 40 years hold .
387,152353,80.0,it,945776,1,3,3,Writing an online profile,"
      I'm from Italy. I live in Pisa. Pisa is a small city. It'snt a crowded city. There are a lot of expensive shops and the famous tower
    ",It'snt a crowded city .
388,4761,95.0,it,948606,13,3,99,Comparing two demographic groups,"
      Nowadays the issue of CSR is much more difficult to deal with rather than it was in the past, because the impact corporations have on the environment and community can make the difference. In the twenty-first century we can't dny that natural resources are running out, but we keep on exploiting them without caring too much about it. For some companies CSR is undoubtably a marketing device, to get more visibility in the world of business, in order to rise their income. On the contrary, for some others CSR is considered a waste of money and they prefer conveying their attention to shareholders. I think that now we can no longer have such a careless attitude , above all if we consider that we're living in a global community, where each action has an effect on all the other components, wherever they are in the world! Every person in the world should think about this: what can I do to improve life of others, in addition to mine?
    ","Nowadays the issue of CSR is much more difficult to deal with rather than it was in the past , because the impact corporations have on the environment and community can make the difference ."
389,70722,95.0,it,953342,15,4,116,Making a movie,"
      Personally I have never been too favorable to the opening of large shopping centers. First of all, they have a great impact on the environment occupying large areas close to urban centers. In my city, a big shopping center has closed for the competition caused by other centers and for years the whole area is in ruins since it was not possible to allocate them to other activities. Is it true that the large shopping malls create jobs but impoverished city centers where small businesses are forced to close. Workers employed in a big-box store are often underpaid when you consider the pace of work and hours of opening. In recent years all the great centers shopping malls are open also 14 hours a day and remain open during all weekends and holidays. A positive aspect of the spread of shopping malls is in the quality and freshness of the food. Being subject to greater and more frequent inspections by the health authorities, I think they have more attention to the foods sold.
    ",Is it true that the large shopping malls create jobs but impoverished city centers where small businesses are forced to close .
390,154841,80.0,it,956400,6,6,46,Writing an email of advice,"
      poker is a card game. the dealer deals 2 cards to each player seated at the table. then the dealer draws 5 cards with other players such as perfecting their point. wins the pot of betting the player who has the best combination. is a game of intelligence, courage, bluff, sensations. you can win or lose a lot of money anyway.
    ",wins the pot of betting the player who has the best combination .
391,154841,80.0,it,956400,6,6,46,Writing an email of advice,"
      poker is a card game. the dealer deals 2 cards to each player seated at the table. then the dealer draws 5 cards with other players such as perfecting their point. wins the pot of betting the player who has the best combination. is a game of intelligence, courage, bluff, sensations. you can win or lose a lot of money anyway.
    ","is a game of intelligence , courage , bluff , sensations ."
392,53650,70.0,it,957867,12,1,89,Turning down an invitation,"
      In Italy etiquette is very important at dinner and in many other occasions. A surely important thing is dressing appropriately to the event you are attending. Speaking of table manners, when you are invited to dine at another's house you should not exceed ten minutes of delay nor arrive early, this could be either way annoying to your host. It is appropriate to bring a little present to your host, often a pack of sweets or a bottle of wine. There are many common etiquette tips to be respected, like waiting for the host to start the eating, using cutlery properly, leaving politely the seat if you recieve an impotant call. Is quite unpolite to leave you phone lying on the table or to answer sms interrupting visual contact with your speakers. Although eating customs vary quite a bit from place to place, in my place is considered very unpleasant to the host, expecially who cooked the meal, not to finish your deal; al least you should have a good try of all the stuff offered even if you are full. When an encore of a dish is offered to you, better be honest on your intentions, either not beeing esitant if you wish to eat or politely discarding if you are full.%% This is related only to an informal and familiar context however.
    ",Is quite unpolite to leave you phone lying on the table or to answer sms interrupting visual contact with your speakers .
393,115771,90.0,it,958911,1,3,3,Writing an online profile,"
      I live near Rome. The name's city is Ciampino. Is very nice because there is a nice park and a little shop. There are more trees and a big square. It's a nice city!
    ",Is very nice because there is a nice park and a little shop .
