,learner_id,grades,nationality,writing_id,levels,unit,topic_id,topic_text,passage,query_sentence
142,172854,88.0,it,305305,5,4,36,Giving instructions to a house-sitter,"
      Hi Valerio! Watering the plants six times a week. Takes the dog for a walk six times for a week for times of day. In the night give to feed the dog six times a week. In the morning give to feed the birds six times a week. Check the water the birds. In the afternoon give to feed the fish three times a week. Clean the house and sweeo the floor to twice a week. Thanks
    ",Takes the dog for a walk six times for a week for times of day .
143,128183,80.0,it,308582,7,1,49,Giving instructions to play a game,"
      Mark an area of about 8 meters by 3 meters. Use ten plastic bottles filled with a little water. Line up the bottles in rows of 4, then 3, then 2, then 1, Each player had a frisbee and take two shot on each turn for a total of ten. Score one point for each pin knocked down. If all the bottles are knocked down, it's a &quot;strike&quot;, then the player takes two more shots and the point are added together. Wins the player with the most point. Don't play this game on a windy day.
    ",Wins the player with the most point .
144,109767,92.0,it,309093,5,8,40,Giving cultural tips to a visitor,"
      Dear Miguel, I can't wait to meet you here! Below there's a list of tips for the behavior to be taken from us. 1) Don't smoke in the public activities. Is forbidden to smoke in these place. 2) Don't talk loudly, we are used to speak very quiet. 3) In the few days of your holiday that we'll not together, you shouldn't go to the north of the city alone, because it's very dangerous. We'll have fun together, see you soon. Dario
    ",Is forbidden to smoke in these place .
145,63979,94.0,it,309715,11,2,82,Helping a coworker deal with a phobia,"
      Hi Ian! How're you doing? I've just heard about your decision to leave your job because of your claustrophobia. I'll be very sad to miss such an experienced colleague. I think you should consider the possibility to treat your phobia and keep your current job. Nowadays a number of treatments and tecniques are availiable for dealing with claustrophobia, so you don't have to let it controll your life. You could look for a medical help and learn some methods for dealing with the symptoms of your phobia. I red about the CBT (Cognitive Behavioral Therapy), a therapy that train the patient's mind towards a more positive and rational way of thinking, so that they no longer feels anxious about enclosed spaces. We could meet for a coffee and talk about it, if you want. What about Thursday evening? Bye now, Claudia
    ","Nowadays a number of treatments and tecniques are availiable for dealing with claustrophobia , so you do n't have to let it controll your life ."
146,55131,89.0,it,313023,7,1,49,Giving instructions to play a game,"
      Mark an area on about 8 metres x by 3 with plastic bottles as bowling pins. Line up them in rows of 4, then 2, then 1. with a frisbee each player is allowed to shot on each turn: ten total turns each. score point knocking down pin: 1 pin, 1 point. Two more shots for strike scored (all the bottles are down). Wins the player with more points. Don't play in a windy day!
    ",Wins the player with more points .
147,76855,85.0,it,320058,10,4,76,Applying to be a fitness trainer,"
      Dear mr. Harry Writing, Id like very much to have the job as fitness instructor in your center. I think Id be perfect for it. I have five years experience as fitness instructor in other gym of my city, and I exactly now how motivate clients to be in shape and help them in their exercise routine. Im a great instructor not only for my qualifications, but, above all, because I love sports and I love to be in shape: I think a healthy life is basic for a happy life. And Im able to transmit these beliefs to clients. I hope youre going to re-contact me. Yours sincerely, L. V.
    ","Im a great instructor not only for my qualifications , but , above all , because I love sports and I love to be in shape : I think a healthy life is basic for a happy life ."
148,163581,90.0,it,326689,4,1,25,Writing about what you do,"
      I'm teacher and I love my job! I always help people and sometimes the people helps me. I always talk with people and I always take breaks with my students. It's a very interesting job, every day there is something new. Sometimes it's tiring, but never boring. The school is a new school and it's very good. It's far of the city, near of the montain. In winter sometimes is so hard, but in springtime and in summer is wonderfull.
    ","Sometimes it 's tiring , but never boring ."
149,149614,90.0,it,328378,7,4,52,Writing about a memorable experience,"
      Hello Tim, I'm fine! Yeah It's been a long time since the last email, I have been so busy with my business to can't even check my emails. Oh man, what a great story! Hiro saved you life, and the whole trip. Your story make me remember that time I went to Swiss in a snowboard camp with a couple of friends. While I was riding down the Mt. Avril an huge avalanche buried me. At the end, the dogs found me under the snow and my friends saved me. Next time I will be more careful. Peace, Mario.
    ","Yeah It 's been a long time since the last email , I have been so busy with my business to ca n't even check my emails ."
150,87266,88.0,it,330823,3,5,21,Giving suggestions about clothing,"
      Why don't you buy the red hat? Is not expensive! I think you should buy the beige sweater, but only the size medium. The blu sweatshirt is nice, but you size is XXL! How about the white pants for me?
    ",Is not expensive !
151,87266,100.0,it,330824,3,6,22,Writing your online profile,"
      Name : Raniero; Age : 58; Birthday: 20/02; Like doing: studying English, walking with my wife and traveling with my wife. Lives in : Rome , Italy; Favorite: Season: winter ( in Rome); Animal: dog; Time: evening ( in summer time, in old town ).
    ","Lives in : Rome , Italy ; Favorite : Season : winter ( in Rome ) ; Animal : dog ; Time : evening ( in summer time , in old town ) ."
152,65699,75.0,it,330877,8,5,61,Selling items in an online auction,"
      I sell my ACER laptop computer. Is a very large screen computer, over 17 cm wide. is 2 year old. The ram is 4 gb and the totaly memory is 200 gb you can use it also to watch movie, becouse it can read blu ray dvd. It has a dolby surround sistem. It is perfect if you have young kids to play their best cartoon every time you need, without keep the tv busy. So that you can see your favourite football macht on sky. It has a long use battery, more then 4 hour , and of course wii fii connection. I will sell it only for 50. I want to buy Ipad 3. ciao
    ","Is a very large screen computer , over 17 cm wide ."
153,65699,75.0,it,330877,8,5,61,Selling items in an online auction,"
      I sell my ACER laptop computer. Is a very large screen computer, over 17 cm wide. is 2 year old. The ram is 4 gb and the totaly memory is 200 gb you can use it also to watch movie, becouse it can read blu ray dvd. It has a dolby surround sistem. It is perfect if you have young kids to play their best cartoon every time you need, without keep the tv busy. So that you can see your favourite football macht on sky. It has a long use battery, more then 4 hour , and of course wii fii connection. I will sell it only for 50. I want to buy Ipad 3. ciao
    ",is 2 year old .
154,45952,86.0,it,332858,4,2,26,Describing routines,"
      sean plays basktball once a week. plays computer games every afternoon. watches tv on sunday 6 pm. granny. does washes the dishes at 10 am. does gardening in the afternoon. sets the table at 6.30pm. mary. feed the dog at 8 am every day. walk the dog in the morning. feed the dog again at 6 pm every day.
    ",plays computer games every afternoon .
155,45952,86.0,it,332858,4,2,26,Describing routines,"
      sean plays basktball once a week. plays computer games every afternoon. watches tv on sunday 6 pm. granny. does washes the dishes at 10 am. does gardening in the afternoon. sets the table at 6.30pm. mary. feed the dog at 8 am every day. walk the dog in the morning. feed the dog again at 6 pm every day.
    ",does washes the dishes at 10 am .
156,45952,86.0,it,332858,4,2,26,Describing routines,"
      sean plays basktball once a week. plays computer games every afternoon. watches tv on sunday 6 pm. granny. does washes the dishes at 10 am. does gardening in the afternoon. sets the table at 6.30pm. mary. feed the dog at 8 am every day. walk the dog in the morning. feed the dog again at 6 pm every day.
    ",does gardening in the afternoon .
157,45952,86.0,it,332858,4,2,26,Describing routines,"
      sean plays basktball once a week. plays computer games every afternoon. watches tv on sunday 6 pm. granny. does washes the dishes at 10 am. does gardening in the afternoon. sets the table at 6.30pm. mary. feed the dog at 8 am every day. walk the dog in the morning. feed the dog again at 6 pm every day.
    ",sets the table at 6.30pm .
158,164395,96.0,it,338976,13,4,100,Giving advice about budgeting,"
      Dear Paula,this is a very difficult moment for every people all over the world. This financial crisis has caused many problems in our lives and now we all are suffering about it. Problems that seemed to be so far away from us now are becoming very common and so we must make some changes to face them. The very first change we need to make is about our daily alimentary habits. You wrote me that food was the main feature in your life every day since breakfast till dinner, so it would be better make some changes. For example you might start having your breakfast at home with a little cup of coffe made using a moka, a glass of cheap milk or a cup of tea. About lunch, you could eat something cheap and healthy like a vegetable salad and some fruit. As last thing, I think you must rinunce at your dinners at restaurants. Why don't you have more cheaper and easier dinners at home with your friends? You will see, with all these little changes you will able to save much money.
    ",Problems that seemed to be so far away from us now are becoming very common and so we must make some changes to face them .
159,133859,93.0,it,355358,5,1,33,Planning to attend a music festival,"
      Hy mom and dad, in September I'm gonna visit Belgrade, the capital of Serbia, and I'm gonna see the famous Serbian Festival. It'll be from 15th to 18th of Semptemer. Tickets cost only 10 . I'm gonna take bus from milano and I'm gonna stay in a two stars Hotel in the center of the city. It'll be hot enough, so I'll bring only t-shirts, jeans and sneakers. Love you.
    ",Tickets cost only 10 .
160,49612,85.0,it,355616,5,8,40,Giving cultural tips to a visitor,"
      Dear friend, in my opinion you should stay at home, don't come in Canada. Here is considerate inappropriate a lot behaviour absolutely normally in Italy. You shouldn't yell, speak or talk on the phone loud and even stand in line! Is outlaw smoke in public bilding or transportation. Give gift or flowers when visiting is appropriate, as pass through a door woman go first; inappropriate put elbow on the table and leave early. Unacceptable! Lovely Giorgio
    ",Is outlaw smoke in public bilding or transportation .
161,49612,89.0,it,355619,6,3,43,Creating an office dress code,"
      OK boss, in my opinion the best way is give to our staff a navy blue suit, made in natural fiber only , like cotton and wool. Woman should choose a middle skirt or a pant. Under the jacket everibody must wearing a light blu shirt and grey tie. Shoes must be only laced and black. Is not allowed caps, bracelets and necklege. This might be my dress code. Best regards. Jonh
    ","Is not allowed caps , bracelets and necklege ."
162,79473,92.0,it,356991,4,2,26,Describing routines,"
      Anna Does the laundry on Monday in the morning. Does the ironing on Tuesday in the afternoon. Cleans the house every day. Mops the floor every day. Makes dinner at 7pm every day. Sets the table. Washes the dishes at night. Does the shopping once a week. Vitto Feeds the dogs at 8am every day. Walks the dog in the afternoon. Feeds the dog again at 5pm every day.
    ",Does the ironing on Tuesday in the afternoon .
163,79473,92.0,it,356991,4,2,26,Describing routines,"
      Anna Does the laundry on Monday in the morning. Does the ironing on Tuesday in the afternoon. Cleans the house every day. Mops the floor every day. Makes dinner at 7pm every day. Sets the table. Washes the dishes at night. Does the shopping once a week. Vitto Feeds the dogs at 8am every day. Walks the dog in the afternoon. Feeds the dog again at 5pm every day.
    ",Cleans the house every day .
164,79473,92.0,it,356991,4,2,26,Describing routines,"
      Anna Does the laundry on Monday in the morning. Does the ironing on Tuesday in the afternoon. Cleans the house every day. Mops the floor every day. Makes dinner at 7pm every day. Sets the table. Washes the dishes at night. Does the shopping once a week. Vitto Feeds the dogs at 8am every day. Walks the dog in the afternoon. Feeds the dog again at 5pm every day.
    ",Sets the table .
165,79473,92.0,it,356991,4,2,26,Describing routines,"
      Anna Does the laundry on Monday in the morning. Does the ironing on Tuesday in the afternoon. Cleans the house every day. Mops the floor every day. Makes dinner at 7pm every day. Sets the table. Washes the dishes at night. Does the shopping once a week. Vitto Feeds the dogs at 8am every day. Walks the dog in the afternoon. Feeds the dog again at 5pm every day.
    ",Washes the dishes at night .
166,79473,92.0,it,356991,4,2,26,Describing routines,"
      Anna Does the laundry on Monday in the morning. Does the ironing on Tuesday in the afternoon. Cleans the house every day. Mops the floor every day. Makes dinner at 7pm every day. Sets the table. Washes the dishes at night. Does the shopping once a week. Vitto Feeds the dogs at 8am every day. Walks the dog in the afternoon. Feeds the dog again at 5pm every day.
    ",Does the shopping once a week .
167,79473,92.0,it,356991,4,2,26,Describing routines,"
      Anna Does the laundry on Monday in the morning. Does the ironing on Tuesday in the afternoon. Cleans the house every day. Mops the floor every day. Makes dinner at 7pm every day. Sets the table. Washes the dishes at night. Does the shopping once a week. Vitto Feeds the dogs at 8am every day. Walks the dog in the afternoon. Feeds the dog again at 5pm every day.
    ",Feeds the dog again at 5pm every day .
168,30054,96.0,it,368334,4,2,26,Describing routines,"
      Sean plays basketball every day in the evening and plays compter games at 6 pm in the evening, every day. He watches movies on Saturday's at 5 pm in the afternoon. Grammy does the laundry on Tuesday afternoon and does gardening in the morning. Sets the table ot 8pm every evening. I usually walk dog in the evening after dinner.
    ",Sets the table ot 8pm every evening .
169,126911,96.0,it,373926,4,2,26,Describing routines,"
      Sean plays basketball every afternoon. Plays computer games at 6pm and watches movies on Saturdays at 5pm. Granny does Laundry on Tuesday afternoon. Does gardening in the morning and sets the table at 6pm. I feed the dog at 8am every day. I walk the dog in the afternoon and I feed the dog again at 5pm every day.
    ",Plays computer games at 6pm and watches movies on Saturdays at 5pm .
170,126911,96.0,it,373926,4,2,26,Describing routines,"
      Sean plays basketball every afternoon. Plays computer games at 6pm and watches movies on Saturdays at 5pm. Granny does Laundry on Tuesday afternoon. Does gardening in the morning and sets the table at 6pm. I feed the dog at 8am every day. I walk the dog in the afternoon and I feed the dog again at 5pm every day.
    ",Does gardening in the morning and sets the table at 6pm .
171,76923,87.0,it,374887,2,5,13,Making notes for a visitor,"
      Your welcome in my house. Is the park on palermo street. The library is between the swimming pool and the train station. There are many restaurants on vinci street. The banck is opposite the hospital.
    ",Is the park on palermo street .
172,76923,80.0,it,374920,6,6,46,Writing an email of advice,"
      Don't worry, I can help you. You should following this advise: Firstly You should to check how much money did you spend in this month. How many things what I bought was necessary? Secondly You should speak with your family of this problem. Is very important looking help's family. Finally You should put your mind in another thing as started play tennis or learned play guitar. You will can do.
    ",Is very important looking help 's family .
173,109911,88.0,it,375526,5,2,34,Writing a holiday postcard,"
      Hi mum and dad, Santa Monica, California, it's very beautiful. Today the weather is wet and rainy, then I'm going to the museum and after I'm going to eat out. Tomorrow, the weather it's going to be hot and sunny, then I'll go to the beautiful beach, in the morning. In the evening, I'll go to the big bar. Holiday it's very exciting and great fun. See you soon! Salvatore.
    ",Holiday it 's very exciting and great fun .
174,90751,90.0,it,381078,8,2,58,Reviewing a song for a website,"
      Home Improvement is song of Josh Woodward, a song-writer singer. It'is a lighter, smoother pop song, different from other songs of this singer. The song is a protest song, it has a full arrangement, not only guitar and singer. The theme is consumer society, building and rebuilding don't improve our lives. The point is that sometimes we would rather not change things: natural, older things are often better than the new. The lyrics are not happy, the words are about a negative issue but music is uplifting. This contrast make the song enjoyable. Fans of Woodward will appreciate this song, it has the property of relaxing whithout forgetting the social problems.
    ","It'is a lighter , smoother pop song , different from other songs of this singer ."
175,122914,93.0,it,383417,5,2,34,Writing a holiday postcard,"
      Hi Mum, in Santa Monica is going to rain all afternoon. Is going to very wet. Today I'm going to the museum and I'm going to eat at one of the great restaurants. Tomorrow the weather is going to very hot and sunny. I'm going to go to the beautiful beach. In the evening I'm going to the bar. It's going to very exciting and great fun.
    ",Is going to very wet .
176,40434,91.0,it,385373,7,1,49,Giving instructions to play a game,"
      Make an area for about 8 meters x 3 meters, it'll be the &quot;bowling alley&quot;.Line up 10 bottles in 4 rows of 4, 3, 2 and 1 like ten-pin bowling.Now, take the frisbee and throw it tryng to knock down the pins.Each player is allowed to take two shots on each turn. Is scored one point for each pin knocked down.If all the pins are knocked down the player takes two more shots.Win who have most points.
    ",Is scored one point for each pin knocked down.If all the pins are knocked down the player takes two more shots.Win who have most points .
177,21987,80.0,it,387184,7,1,49,Giving instructions to play a game,"
      Today we play tennis. We have a court, a net, a ball and two rackets. Each player have to hit the ball with the racket over the net. Wins the palyer who throw more ballson the other side of the net. Tomorrow we will play basket ball. Two teams of six players. Wins the team wich throw more ball into the basket. We could even play football. Two teams of 11 players, a ball, two doors. We can play only hitting the ball with the foots. Wins the team wich makes more goals
    ",Wins the palyer who throw more ballson the other side of the net .
178,21987,80.0,it,387184,7,1,49,Giving instructions to play a game,"
      Today we play tennis. We have a court, a net, a ball and two rackets. Each player have to hit the ball with the racket over the net. Wins the palyer who throw more ballson the other side of the net. Tomorrow we will play basket ball. Two teams of six players. Wins the team wich throw more ball into the basket. We could even play football. Two teams of 11 players, a ball, two doors. We can play only hitting the ball with the foots. Wins the team wich makes more goals
    ",Wins the team wich throw more ball into the basket .
179,111211,85.0,it,389330,7,1,49,Giving instructions to play a game,"
      Mark an area of about 8 meters x by 3 meters as bowling alley. Use ten plastic bottles as bowling pins, fill it with a little water to make them heavier. Line up the bottles in rows of 4, then 3, then 2, then 1, just like ten-pin bowling.Give each player a frisbee and allow him to take two shots on each turn. Give ten turns to each player. Score one point for each pin knock down. If the player knock down all the bottles, then he takes two more shots and add all the point together. Wins the player with the most points.
    ",Wins the player with the most points .
180,34492,86.0,it,390667,7,2,50,Planning for the future,"
      Career Plan Patrizia Curatolo 1. First, I 'll make a fantasy CV! Sounds like a great idea and I'll practice doing job interviews to help me get used to the type of question asked 2. Next, I'll plan careers fairs, a good opportunity to meet potential employers 3. Another thing, I'll take a gap year. I 'll get out into the world and learn about another culture 4. The fourth stage of my plane is a work placement during the university break: is great way to get experience 5. Finally, I will became volunteer and work with the Peace Corps.
    ",Sounds like a great idea and I 'll practice doing job interviews to help me get used to the type of question asked 2 .
181,123525,97.0,it,397748,11,3,83,Writing an advertising blurb,"
      Are you having some trouble with foreign languages and you dont know what to do? Heres the solution for your problems! The new Transformer Translator will easily satisfy your requests! For only 235 $ you can buy this new gadget which, with its 10 ozs, is the lightest TT has ever been invented! Whats more, this new, hand-held TT with its built- in software such as; world time zone clock, currency converter, world radio, pedometers will become you personal assistant too. Theres still more, the new Transformer Translator is fitted with pre-loaded software that make you listen to your pronunciation and corrects you in no less than 50 languages! So, dont hesitate, run to buy the new TT today!!!
    ",Heres the solution for your problems !
182,23224,95.0,it,400350,7,1,49,Giving instructions to play a game,"
      Istrucyions for Frisbee Bowling Mark the &quot;bowling alley&quot;: an area of 8 meters x 3 meters Fill ten plastic bottles with a little water. Ligne up the bottles in rows of 4, then 3, then 2, then 1- just like ten-pin bowling. Give a frisbee to each player. Rules: Each player takes two shots on each turn. Turns: ten turns for each player. Point: one point for one bottle knocked down. The player takes two more shots If all the bottle are knocked down (strike). All the points are added toghether. The winner is the player with the most point
    ",Turns : ten turns for each player .
183,80775,89.0,it,403419,1,6,6,Signing up for a dating website,"
      Goodmorning Ms. Jane,further to our last telephone conversation I would outline your first day in our office.As you know, your role is Finance Manager, then I would like you  meet Eric Hosborn, who you will report to.After that, Eric will show you around the four departments making a brief speech to introduce you to relative teams.All this will take 2 hours, from 11:00 am to 1:00 pm ; then there will be the lunch with your team.I remember you that your official start date is 5 July.  Is essential that you know some basic information about Sound and Vision: it was found 30 years ago by John Macinsee, who is the AD now; the HQ is in California, but we have three bases in Europe with 3,000 employees in the world. You will find further information on our website.Yours sincerely.
    ","Is essential that you know some basic information about Sound and Vision : it was found 30 years ago by John Macinsee , who is the AD now ; the HQ is in California , but we have three bases in Europe with 3,000 employees in the world ."
184,65605,97.0,it,405807,6,3,43,Creating an office dress code,"
      Dear John, Thank you for interest the Dress Code. Is important a Dress Code in our office and then I think that a new Dress Code. For Men is important a black pants and white shirt with the black tie. For Women is important a black and white dresses or a blue navy, also jewels and good make up. Thank you for everything. Doctor Gianpaolo Mazzola
    ",Is important a Dress Code in our office and then I think that a new Dress Code .
185,65605,79.0,it,405835,10,1,73,Helping a friend find a job,"
      Hi, Hanna!I've found an absolutely amazing job for you. Let me tell you why you should apply in this work. I think that this job is exhilarating. I want encourage you for bring this work because I think that urge for you. It is by far the cleaner in the office and then I thinh that is important for your career, because it is a gorgeous and beautiful. is important for your pay because in this moment is difficult find a job that you give the $ 50.000 in the year and one month free for Holiday. Also this is important. I think you have been very fotunate, because tis job is difficult to find in this moment of crisis.SincerelyYour friend Gianpaolo. 
    ",is important for your pay because in this moment is difficult find a job that you give the $ 50.000 in the year and one month free for Holiday .
186,104550,100.0,it,405957,2,2,10,Writing a birthday invitation,"
      Hi! Im 54 on Saturday. Im having a party at my house. Lets eat cake, dance, listen to music and sing. The party starts at 7:30 in the evening.Hope you can come! Dionisio
    ","Lets eat cake , dance , listen to music and sing ."
